2025-12-20 22:08:11,646 - thread-130546535499456.app.docker.base_container - INFO - Created temporary project directory: /tmp/tmp4exa39u2/pytest
2025-12-20 22:08:11,646 - thread-130546535499456.app.docker.base_container - DEBUG - Using workdir: /testbed
2025-12-20 22:08:11,646 - thread-130546535499456.app.docker.base_container - INFO - Pulling docker image: swebench/sweb.eval.x86_64.pytest-dev_1776_pytest-5809:v1
2025-12-20 22:09:05,498 - thread-130546535499456.app.docker.base_container - INFO - Tagging pulled image as: prometheus_user_defined_container_ce2c188af0
2025-12-20 22:09:05,506 - thread-130546535499456.app.docker.base_container - INFO - Starting container from image prometheus_user_defined_container_ce2c188af0
2025-12-20 22:09:06,780 - thread-130546535499456.app.docker.base_container - INFO - Starting persistent shell for interactive mode...
2025-12-20 22:09:07,685 - thread-130546535499456.app.docker.base_container - INFO - Persistent shell is ready
2025-12-20 22:09:07,685 - thread-130546535499456.app.docker.base_container - DEBUG - Executing command: . /opt/miniconda3/bin/activate
2025-12-20 22:09:07,918 - thread-130546535499456.app.docker.base_container - DEBUG - Command exit code: 0
2025-12-20 22:09:07,918 - thread-130546535499456.app.docker.base_container - DEBUG - Command output:


2025-12-20 22:09:07,918 - thread-130546535499456.app.docker.base_container - DEBUG - Executing command: conda activate testbed
2025-12-20 22:09:08,149 - thread-130546535499456.app.docker.base_container - DEBUG - Command exit code: 0
2025-12-20 22:09:08,150 - thread-130546535499456.app.docker.base_container - DEBUG - Command output:


2025-12-20 22:09:08,150 - thread-130546535499456.app.docker.base_container - DEBUG - Executing command: python -m pip install -e .
2025-12-20 22:09:14,829 - thread-130546535499456.app.docker.base_container - DEBUG - Command exit code: 0
2025-12-20 22:09:14,829 - thread-130546535499456.app.docker.base_container - DEBUG - Command output:

Obtaining file:///testbed
  Installing build dependencies ... [?25l- \ | / - \ | / done
[?25h  Checking if build backend supports build_editable ... [?25ldone
[?25h  Getting requirements to build editable ... [?25l- done
[?25h  Preparing editable metadata (pyproject.toml) ... [?25l- \ done
[?25hRequirement already satisfied: py>=1.5.0 in /opt/miniconda3/envs/testbed/lib/python3.9/site-packages (from pytest==4.6.6.dev9+g8aba863a6) (1.11.0)
Requirement already satisfied: six>=1.10.0 in /opt/miniconda3/envs/testbed/lib/python3.9/site-packages (from pytest==4.6.6.dev9+g8aba863a6) (1.16.0)
Requirement already satisfied: packaging in /opt/miniconda3/envs/testbed/lib/python3.9/site-packages (from pytest==4.6.6.dev9+g8aba863a6) (23.1)
Requirement already satisfied: attrs>=17.4.0 in /opt/miniconda3/envs/testbed/lib/python3.9/site-packages (from pytest==4.6.6.dev9+g8aba863a6) (23.1.0)
Requirement already satisfied: more-itertools>=4.0.0 in /opt/miniconda3/envs/testbed/lib/python3.9/site-packages (from pytest==4.6.6.dev9+g8aba863a6) (10.1.0)
Requirement already satisfied: atomicwrites>=1.0 in /opt/miniconda3/envs/testbed/lib/python3.9/site-packages (from pytest==4.6.6.dev9+g8aba863a6) (1.4.1)
Requirement already satisfied: pluggy<1.0,>=0.12 in /opt/miniconda3/envs/testbed/lib/python3.9/site-packages (from pytest==4.6.6.dev9+g8aba863a6) (0.13.1)
Requirement already satisfied: importlib-metadata>=0.12 in /opt/miniconda3/envs/testbed/lib/python3.9/site-packages (from pytest==4.6.6.dev9+g8aba863a6) (8.5.0)
Requirement already satisfied: wcwidth in /opt/miniconda3/envs/testbed/lib/python3.9/site-packages (from pytest==4.6.6.dev9+g8aba863a6) (0.2.6)
Requirement already satisfied: zipp>=3.20 in /opt/miniconda3/envs/testbed/lib/python3.9/site-packages (from importlib-metadata>=0.12->pytest==4.6.6.dev9+g8aba863a6) (3.20.2)
Building wheels for collected packages: pytest
  Building editable for pytest (pyproject.toml) ... [?25l- \ done
[?25h  Created wheel for pytest: filename=pytest-4.6.6.dev9+g8aba863a6-0.editable-py2.py3-none-any.whl size=4873 sha256=e43a19b63a1a385c47c571e7dd95393f8298bf2da90cb4b8b4b091f5ea5706ef
  Stored in directory: /tmp/pip-ephem-wheel-cache-q4san_zk/wheels/7d/66/67/70d1ee2124ccf21d601c352e25cdca10f611f7c8b3f9ffb9e4
Successfully built pytest
Installing collected packages: pytest
  Attempting uninstall: pytest
    Found existing installation: pytest 4.6.6.dev9+g8aba863a6
    Uninstalling pytest-4.6.6.dev9+g8aba863a6:
      Successfully uninstalled pytest-4.6.6.dev9+g8aba863a6
Successfully installed pytest-4.6.6.dev9+g8aba863a6
[33mWARNING: Running pip as the 'root' user can result in broken permissions and conflicting behaviour with the system package manager, possibly rendering your system unusable.It is recommended to use a virtual environment instead: https://pip.pypa.io/warnings/venv. Use the --root-user-action option if you know what you are doing and want to suppress this warning.[0m[33m

2025-12-20 22:09:14,861 - thread-130546535499456.app.lang_graph.nodes.focal_code_retrieval_node - INFO - Retrieving focal code context via external CRA
2025-12-20 22:13:09,613 - thread-130546535499456.app.lang_graph.nodes.focal_code_retrieval_node - INFO - Focal code context retrieved: 1 items
2025-12-20 22:13:09,614 - thread-130546535499456.app.lang_graph.nodes.test_case_retrieval_node - INFO - Retrieving test case context via external CRA
2025-12-20 22:16:23,603 - thread-130546535499456.app.lang_graph.nodes.test_case_retrieval_node - INFO - Test case context retrieved: 1 items
2025-12-20 22:16:23,605 - thread-130546535499456.app.lang_graph.nodes.bug_reproducing_write_message_node - DEBUG - Sending message to BugReproducingWriteNode:
content='Issue title:\nLexer "python3" in --pastebin feature causes HTTP errors\n\nIssue description: \nThe `--pastebin` option currently submits the output of `pytest` to `bpaste.net` using `lexer=python3`: https://github.com/pytest-dev/pytest/blob/d47b9d04d4cf824150caef46c9c888779c1b3f58/src/_pytest/pastebin.py#L68-L73\n\nFor some `contents`, this will raise a "HTTP Error 400: Bad Request".\n\nAs an example:\n~~~\n>>> from urllib.request import urlopen\n>>> with open("data.txt", "rb") as in_fh:\n...     data = in_fh.read()\n>>> url = "https://bpaste.net"\n>>> urlopen(url, data=data)\nHTTPError: Bad Request\n~~~\nwith the attached [data.txt](https://github.com/pytest-dev/pytest/files/3561212/data.txt).\n\nThis is the underlying cause for the problems mentioned in #5764.\n\nThe call goes through fine if `lexer` is changed from `python3` to `text`. This would seem like the right thing to do in any case: the console output of a `pytest` run that is being uploaded is not Python code, but arbitrary text.\n\n\nIssue comments:\n\n\nPatch Information:\n```diff\ndiff --git a/src/_pytest/pastebin.py b/src/_pytest/pastebin.py\nindex 41576a615..307a61f42 100644\n--- a/src/_pytest/pastebin.py\n+++ b/src/_pytest/pastebin.py\n@@ -66,7 +66,7 @@ def create_new_paste(contents):\n     """\n     Creates a new paste using bpaste.net service.\n \n-    :contents: paste contents as utf-8 encoded bytes\n+    :contents: paste contents as a text string or utf-8 encoded bytes\n     :returns: url to the pasted contents\n     """\n     import re\n@@ -78,8 +78,8 @@ def create_new_paste(contents):\n         from urllib.parse import urlencode\n \n     params = {\n-        "code": contents,\n-        "lexer": "python3" if sys.version_info[0] >= 3 else "python",\n+        "code": contents.decode("utf-8", "replace") if isinstance(contents, six.binary_type) else contents,\n+        "lexer": "text",\n         "expiry": "1week",\n     }\n     url = "https://bpaste.net"\ndiff --git a/testing/test_pastebin.py b/testing/test_pastebin.py\nindex bac8f9802..aac0b651e 100644\n--- a/testing/test_pastebin.py\n+++ b/testing/test_pastebin.py\n@@ -126,8 +126,7 @@ class TestPaste(object):\n         assert len(mocked_urlopen) == 1\n         url, data = mocked_urlopen[0]\n         assert type(data) is bytes\n-        lexer = "python3" if sys.version_info[0] >= 3 else "python"\n         assert url == "https://bpaste.net"\n-        assert "lexer=%s" % lexer in data.decode()\n+        assert "lexer=text" in data.decode()\n         assert "code=full-paste-contents" in data.decode()\n         assert "expiry=1week" in data.decode()\n\n```\n\nFocal Code Context (relevant code that may need fixing):\n{\'relative_path\': \'src/_pytest/pastebin.py\', \'content\': \'1. # -*- coding: utf-8 -*-\\n2. """ submit failure or test session information to a pastebin service. """\\n3. from __future__ import absolute_import\\n4. from __future__ import division\\n5. from __future__ import print_function\\n6. \\n7. import sys\\n8. import tempfile\\n9. \\n10. import six\\n11. \\n12. import pytest\\n13. \\n14. \\n15. def pytest_addoption(parser):\\n16.     group = parser.getgroup("terminal reporting")\\n17.     group._addoption(\\n18.         "--pastebin",\\n19.         metavar="mode",\\n20.         action="store",\\n21.         dest="pastebin",\\n22.         default=None,\\n23.         choices=["failed", "all"],\\n24.         help="send failed|all info to bpaste.net pastebin service.",\\n25.     )\\n26. \\n27. \\n28. @pytest.hookimpl(trylast=True)\\n29. def pytest_configure(config):\\n30.     if config.option.pastebin == "all":\\n31.         tr = config.pluginmanager.getplugin("terminalreporter")\\n32.         # if no terminal reporter plugin is present, nothing we can do here;\\n33.         # this can happen when this function executes in a slave node\\n34.         # when using pytest-xdist, for example\\n35.         if tr is not None:\\n36.             # pastebin file will be utf-8 encoded binary file\\n37.             config._pastebinfile = tempfile.TemporaryFile("w+b")\\n38.             oldwrite = tr._tw.write\\n39. \\n40.             def tee_write(s, **kwargs):\\n41.                 oldwrite(s, **kwargs)\\n42.                 if isinstance(s, six.text_type):\\n43.                     s = s.encode("utf-8")\\n44.                 config._pastebinfile.write(s)\\n45. \\n46.             tr._tw.write = tee_write\\n47. \\n48. \\n49. def pytest_unconfigure(config):\\n50.     if hasattr(config, "_pastebinfile"):\\n51.         # get terminal contents and delete file\\n52.         config._pastebinfile.seek(0)\\n53.         sessionlog = config._pastebinfile.read()\\n54.         config._pastebinfile.close()\\n55.         del config._pastebinfile\\n56.         # undo our patching in the terminal reporter\\n57.         tr = config.pluginmanager.getplugin("terminalreporter")\\n58.         del tr._tw.__dict__["write"]\\n59.         # write summary\\n60.         tr.write_sep("=", "Sending information to Paste Service")\\n61.         pastebinurl = create_new_paste(sessionlog)\\n62.         tr.write_line("pastebin session-log: %s\\\\n" % pastebinurl)\\n63. \\n64. \\n65. def create_new_paste(contents):\\n66.     """\\n67.     Creates a new paste using bpaste.net service.\\n68. \\n69.     :contents: paste contents as utf-8 encoded bytes\\n70.     :returns: url to the pasted contents\\n71.     """\\n72.     import re\\n73. \\n74.     if sys.version_info < (3, 0):\\n75.         from urllib import urlopen, urlencode\\n76.     else:\\n77.         from urllib.request import urlopen\\n78.         from urllib.parse import urlencode\\n79. \\n80.     params = {\\n81.         "code": contents,\\n82.         "lexer": "python3" if sys.version_info[0] >= 3 else "python",\\n83.         "expiry": "1week",\\n84.     }\\n85.     url = "https://bpaste.net"\\n86.     response = urlopen(url, data=urlencode(params).encode("ascii")).read()\\n87.     m = re.search(r\\\'href="/raw/(\\\\w+)"\\\', response.decode("utf-8"))\\n88.     if m:\\n89.         return "%s/show/%s" % (url, m.group(1))\\n90.     else:\\n91.         return "bad response: " + response\\n92. \\n93. \\n94. def pytest_terminal_summary(terminalreporter):\\n95.     import _pytest.config\\n96. \\n97.     if terminalreporter.config.option.pastebin != "failed":\\n98.         return\\n99.     tr = terminalreporter\\n100.     if "failed" in tr.stats:\\n101.         terminalreporter.write_sep("=", "Sending information to Paste Service")\\n102.         for rep in terminalreporter.stats.get("failed"):\\n103.             try:\\n104.                 msg = rep.longrepr.reprtraceback.reprentries[-1].reprfileloc\\n105.             except AttributeError:\\n106.                 msg = tr._getfailureheadline(rep)\\n107.             tw = _pytest.config.create_terminal_writer(\\n108.                 terminalreporter.config, stringio=True\\n109.             )\\n110.             rep.toterminal(tw)\\n111.             s = tw.stringio.getvalue()\\n112.             assert len(s)\\n113.             pastebinurl = create_new_paste(s)\\n114.             tr.write_line("%s --> %s" % (msg, pastebinurl))\', \'start_line_number\': 1, \'end_line_number\': 114}\n\nTest Case Context (similar existing tests for reference):\n{\'relative_path\': \'testing/test_pastebin.py\', \'content\': \'1. # -*- coding: utf-8 -*-\\n2. from __future__ import absolute_import\\n3. from __future__ import division\\n4. from __future__ import print_function\\n5. \\n6. import sys\\n7. \\n8. import pytest\\n9. \\n10. \\n11. class TestPasteCapture(object):\\n12.     @pytest.fixture\\n13.     def pastebinlist(self, monkeypatch, request):\\n14.         pastebinlist = []\\n15.         plugin = request.config.pluginmanager.getplugin("pastebin")\\n16.         monkeypatch.setattr(plugin, "create_new_paste", pastebinlist.append)\\n17.         return pastebinlist\\n18. \\n19.     def test_failed(self, testdir, pastebinlist):\\n20.         testpath = testdir.makepyfile(\\n21.             """\\n22.             import pytest\\n23.             def test_pass():\\n24.                 pass\\n25.             def test_fail():\\n26.                 assert 0\\n27.             def test_skip():\\n28.                 pytest.skip("")\\n29.         """\\n30.         )\\n31.         reprec = testdir.inline_run(testpath, "--paste=failed")\\n32.         assert len(pastebinlist) == 1\\n33.         s = pastebinlist[0]\\n34.         assert s.find("def test_fail") != -1\\n35.         assert reprec.countoutcomes() == [1, 1, 1]\\n36. \\n37.     def test_all(self, testdir, pastebinlist):\\n38.         from _pytest.pytester import LineMatcher\\n39. \\n40.         testpath = testdir.makepyfile(\\n41.             """\\n42.             import pytest\\n43.             def test_pass():\\n44.                 pass\\n45.             def test_fail():\\n46.                 assert 0\\n47.             def test_skip():\\n48.                 pytest.skip("")\\n49.         """\\n50.         )\\n51.         reprec = testdir.inline_run(testpath, "--pastebin=all", "-v")\\n52.         assert reprec.countoutcomes() == [1, 1, 1]\\n53.         assert len(pastebinlist) == 1\\n54.         contents = pastebinlist[0].decode("utf-8")\\n55.         matcher = LineMatcher(contents.splitlines())\\n56.         matcher.fnmatch_lines(\\n57.             [\\n58.                 "*test_pass PASSED*",\\n59.                 "*test_fail FAILED*",\\n60.                 "*test_skip SKIPPED*",\\n61.                 "*== 1 failed, 1 passed, 1 skipped in *",\\n62.             ]\\n63.         )\\n64. \\n65.     def test_non_ascii_paste_text(self, testdir):\\n66.         """Make sure that text which contains non-ascii characters is pasted\\n67.         correctly. See #1219.\\n68.         """\\n69.         testdir.makepyfile(\\n70.             test_unicode="""\\n71.             # -*- coding: utf-8 -*-\\n72.             def test():\\n73.                 assert \\\'☺\\\' == 1\\n74.         """\\n75.         )\\n76.         result = testdir.runpytest("--pastebin=all")\\n77.         if sys.version_info[0] >= 3:\\n78.             expected_msg = "*assert \\\'☺\\\' == 1*"\\n79.         else:\\n80.             expected_msg = "*assert \\\'\\\\\\\\xe2\\\\\\\\x98\\\\\\\\xba\\\' == 1*"\\n81.         result.stdout.fnmatch_lines(\\n82.             [\\n83.                 expected_msg,\\n84.                 "*== 1 failed in *",\\n85.                 "*Sending information to Paste Service*",\\n86.             ]\\n87.         )\\n88. \\n89. \\n90. class TestPaste(object):\\n91.     @pytest.fixture\\n92.     def pastebin(self, request):\\n93.         return request.config.pluginmanager.getplugin("pastebin")\\n94. \\n95.     @pytest.fixture\\n96.     def mocked_urlopen(self, monkeypatch):\\n97.         """\\n98.         monkeypatch the actual urlopen calls done by the internal plugin\\n99.         function that connects to bpaste service.\\n100.         """\\n101.         calls = []\\n102. \\n103.         def mocked(url, data):\\n104.             calls.append((url, data))\\n105. \\n106.             class DummyFile(object):\\n107.                 def read(self):\\n108.                     # part of html of a normal response\\n109.                     return b\\\'View <a href="/raw/3c0c6750bd">raw</a>.\\\'\\n110. \\n111.             return DummyFile()\\n112. \\n113.         if sys.version_info < (3, 0):\\n114.             import urllib\\n115. \\n116.             monkeypatch.setattr(urllib, "urlopen", mocked)\\n117.         else:\\n118.             import urllib.request\\n119. \\n120.             monkeypatch.setattr(urllib.request, "urlopen", mocked)\\n121.         return calls\\n122. \\n123.     def test_create_new_paste(self, pastebin, mocked_urlopen):\\n124.         result = pastebin.create_new_paste(b"full-paste-contents")\\n125.         assert result == "https://bpaste.net/show/3c0c6750bd"\\n126.         assert len(mocked_urlopen) == 1\\n127.         url, data = mocked_urlopen[0]\\n128.         assert type(data) is bytes\\n129.         lexer = "python3" if sys.version_info[0] >= 3 else "python"\\n130.         assert url == "https://bpaste.net"\\n131.         assert "lexer=%s" % lexer in data.decode()\\n132.         assert "code=full-paste-contents" in data.decode()\\n133.         assert "expiry=1week" in data.decode()\', \'start_line_number\': 1, \'end_line_number\': 133}\n\nNow generate the complete self-contained test case that reproduces the bug with the same error/exception.\n' additional_kwargs={} response_metadata={}
2025-12-20 22:16:52,470 - thread-130546535499456.app.lang_graph.nodes.bug_reproducing_write_node - DEBUG - content='```python\n# -*- coding: utf-8 -*-\nfrom __future__ import absolute_import\nfrom __future__ import division\nfrom __future__ import print_function\n\nimport sys\n\nimport pytest\n\n\nclass TestPaste(object):\n    @pytest.fixture\n    def pastebin(self, request):\n        return request.config.pluginmanager.getplugin("pastebin")\n\n    @pytest.fixture\n    def mocked_urlopen(self, monkeypatch):\n        """\n        monkeypatch the actual urlopen calls done by the internal plugin\n        function that connects to bpaste service.\n        """\n        calls = []\n\n        def mocked(url, data):\n            calls.append((url, data))\n\n            class DummyFile(object):\n                def read(self):\n                    # part of html of a normal response\n                    return b\'View <a href="/raw/3c0c6750bd">raw</a>.\'\n\n            return DummyFile()\n\n        if sys.version_info < (3, 0):\n            import urllib\n\n            monkeypatch.setattr(urllib, "urlopen", mocked)\n        else:\n            import urllib.request\n\n            monkeypatch.setattr(urllib.request, "urlopen", mocked)\n        return calls\n\n    def test_create_new_paste_uses_text_lexer(self, pastebin, mocked_urlopen):\n        """\n        Test that create_new_paste uses \'text\' as lexer.\n        The output of a pytest run is not python code, so using a python lexer\n        can fail for some outputs. See #5764.\n        """\n        pastebin.create_new_paste(b"full-paste-contents")\n        assert len(mocked_urlopen) == 1\n        _url, data = mocked_urlopen[0]\n        assert "lexer=text" in data.decode("utf-8")\n\n```' additional_kwargs={} response_metadata={'is_blocked': False, 'safety_ratings': [], 'citation_metadata': {'citations': [{'start_index': 2181, 'end_index': 2466, 'uri': 'https://github.com/pytest-dev/pytest', 'license_': 'MIT', 'title': ''}, {'start_index': 5166, 'end_index': 5488, 'uri': 'https://github.com/pytest-dev/pytest', 'license_': 'MIT', 'title': ''}, {'start_index': 5489, 'end_index': 5955, 'uri': 'https://github.com/pytest-dev/pytest', 'license_': 'MIT', 'title': ''}, {'start_index': 11255, 'end_index': 11577, 'uri': 'https://github.com/pytest-dev/pytest', 'license_': 'MIT', 'title': ''}, {'start_index': 11578, 'end_index': 12067, 'uri': 'https://github.com/pytest-dev/pytest', 'license_': 'MIT', 'title': ''}]}, 'usage_metadata': {'prompt_token_count': 4955, 'candidates_token_count': 423, 'total_token_count': 8407, 'prompt_tokens_details': [{'modality': 1, 'token_count': 4955}], 'candidates_tokens_details': [{'modality': 1, 'token_count': 423}], 'thoughts_token_count': 3029, 'cached_content_token_count': 0, 'cache_tokens_details': []}, 'finish_reason': 'STOP', 'avg_logprobs': -0.9324563028682772, 'model_name': 'gemini-2.5-pro'} id='run--447858ae-84b3-416e-a923-659e3e0330dc-0' usage_metadata={'input_tokens': 4955, 'output_tokens': 423, 'total_tokens': 8407, 'input_token_details': {'cache_read': 0}, 'output_token_details': {'reasoning': 3029}}
2025-12-20 22:17:02,070 - thread-130546535499456.app.lang_graph.nodes.bug_reproducing_file_node - DEBUG - content='' additional_kwargs={'function_call': {'name': 'create_file', 'arguments': '{"content": "# -*- coding: utf-8 -*-\\nfrom __future__ import absolute_import\\nfrom __future__ import division\\nfrom __future__ import print_function\\n\\nimport sys\\n\\nimport pytest\\n\\n\\nclass TestPaste(object):\\n    @pytest.fixture\\n    def pastebin(self, request):\\n        return request.config.pluginmanager.getplugin(\\"pastebin\\")\\n\\n    @pytest.fixture\\n    def mocked_urlopen(self, monkeypatch):\\n        \\"\\"\\"\\n        monkeypatch the actual urlopen calls done by the internal plugin\\n        function that connects to bpaste service.\\n        \\"\\"\\"\\n        calls = []\\n\\n        def mocked(url, data):\\n            calls.append((url, data))\\n\\n            class DummyFile(object):\\n                def read(self):\\n                    # part of html of a normal response\\n                    return b\'View <a href=\\"/raw/3c0c6750bd\\">raw</a>.\'\\n\\n            return DummyFile()\\n\\n        if sys.version_info < (3, 0):\\n            import urllib\\n\\n            monkeypatch.setattr(urllib, \\"urlopen\\", mocked)\\n        else:\\n            import urllib.request\\n\\n            monkeypatch.setattr(urllib.request, \\"urlopen\\", mocked)\\n        return calls\\n\\n    def test_create_new_paste_uses_text_lexer(self, pastebin, mocked_urlopen):\\n        \\"\\"\\"\\n        Test that create_new_paste uses \'text\' as lexer.\\n        The output of a pytest run is not python code, so using a python lexer\\n        can fail for some outputs. See #5764.\\n        \\"\\"\\"\\n        pastebin.create_new_paste(b\\"full-paste-contents\\")\\n        assert len(mocked_urlopen) == 1\\n        _url, data = mocked_urlopen[0]\\n        assert \\"lexer=text\\" in data.decode(\\"utf-8\\")\\n", "relative_path": "testing/test_paste.py"}'}, '__gemini_function_call_thought_signatures__': {'34f01570-0880-4094-b08c-aed9f879ed2c': 'CqkRAY89a1/cqMpPlNflWYbkcnbxGBYWZ4NXauz8obRFDKQWpIcca/GSPo2wZzmXMJSj2krBNLmaNcG1PY1NSxbU7J1yHxlIpdRtZX8oZ75smdR+PdYUhsIaD0cxRbHJ9jGJE6XLmRO4ZEFC+kHiBoxOKg3IkN6ZUaNXI16RnrY5AaQR8RgMZVKFribM5ncIVZo5G6J0LPEU7CqdzHeD4AWxD+/HooUDZZJTNy44YjcWBci8Mk3uoQdPbGxI9NRWJwkDTJ0J1qCKuxgs1ZOOYE0dG6GjNDFsIbDD6K49OC/wRSKNYguf44Tt7GKjzCgXiNVcADof1U9vdEkvJDnqsbMitlrFlPxnnPue7Txe+9sxYHsNZVK30lLik9VCeHU/sQNnCJovQsOHZxHMQn0RKVzkiX6ZTUnLQ+bs/Scbqa747dV9sxaxCmx7GDFsF6hYhjFzN9NzQ/2WEptchGwQSVVyT8krlpHT4am4n6+ONJ35ClmefMETK9qFVtZkUER9MjWLVdPQGVaxWCOc2uRCeG52RB8LPAIXAA+pwCX+nQqKNyUImSYEqXGc+6qyqGA1OucUL0pSfBo4vdoaYti1vW1d43fExuhmPdhm0U7Ljv6BN/Tze63jMbAD8zWN2tSFImcHo4Lv58MtORsKIJ9fULUntKcgMbSocSs0Eiz1fODIG9oCT1ARSHBgLoMowbFaVfWJZ9QP//Ax4UO9Qu68RMY5Oos1wJOB0cDzLckjgwdVfcv++WZquBOeELqovqCDGasmsycYng5E9W+kJAOg6sC9xIpCz0RsuTQcnlo+Z8J6vE+e8McH2E/BgJ8T6tCT5ZGTL7LJAKkS1Tr8pCVMPZoGAyjc+1CQAiBCwzwbU72xtOQVtY28lq2VykCZ2ufWVg4q39iNbSFgRwRl4b2FuIOF6ez7MA/PlvpScRm4kvpGSxappHgsqtJV2xJygxoAZFuwjRPLwPewwb1FKJOeWKd2WtKalq12U1nEfGNPLX9dY4iOygtCZ5F/Ks3iAEk+oWNN6SViPxDDMmClj23bP/SK8CwQ7BifNkhH0Iwzjn8ZpXVyMQ9U525Y5eehEXmm42c4c1loT2qw4pl/HFojb8ECwWr3ZomOH/XkbvW9lw2ALyyBNUjOzK5MtTN2fKhouNZRB9bsMl1WYRAwZS64Z9MI6OSn8ScGHQoSwH8lvhINyiEdWPHzjXbHjd5QPtKJJD/sZZADELsU+atsz31vB8ab1pmB0UZ9VfaQAz4WR12tb/R153QRenIrMquyBbn+SUcw0f70lIdtC9l0N+bKWR96vsz46Tb9RJ9lcxhh3dJmJAAYHJmu1WaI5X9veFvF1TQR3lcIjGqZ49FfERHxfNGRqNENR2r8POqeJAqGQUkIcq59y9QzDGQA8K+/A8DC7+Tlk1WEqg05HaFSRwEr9GfvCAglext6GdJqny65pTFoFNM/3mVkURLB+1fUo8vt+n/cVSnOFhTzzvTaO0sKr5l69oN+hE9/8yax50kpyKHnnszfOEJr49a1+g3nNWQ3hxusMFGok3sf+acIfAydMCq2lqxFyGNSxWi2ct9WX0serayVyxaGUdTPRicZ+8zatWqK8AwZ7XQEL7c2k6RGGrqS54fXHOaz5ezH2K7Vi+7S/jfi2FMCdC6HzZqwVYkZdTUwE1NgG1iqk4N2IJFfyAq6u5B3luldmhSM05xHR//nzRjKmXyd9XZHuTd2xkzhWXYW9P0yIsvHsmJerrv+GVkn+Os8rbrVzi2kMWuNgRwg4ikRSZXurT/ojKcm7ubtjL36Xoe2h0J1JrGzppAIHZFmyStXlWhynqUVNCewxzv3QNtlyna3Jlf8uGxMyGjG45iRbmyDO40LS6zCLZonSCrs7oEObQfDfxkIeLYfbo+JroUTvE0EkB0A5a1UNOzAVnGo0vtSHxinbmEbCEiZv0kDVKcTPxODKb6HeoDndf6IxTQ9zFwRgBlSNy4+v5ZGgmPsAG6IyuLpjd02MsW7kB2ffUyUB+tGk2yj9p2buMWCYKxYL08IjLuJMkFflKiAmoeImDcc/FfZnF3JrqQEvFVwqlbnkEJgOUJpej4UWCDF+h06nlQgXvOkeaBAh7zb8tjCB2bHFX8ZW82D32qi62R88IETFPyDgWDoDKxPAgfZLYmzoFSuwO6tsgpnzjDUNxkOHYYsdAlp/EF7DiCE+P/viSw3aZwu7Kn0mZxV0UO8jHJZQpb4HQFYACe6OMA7nT5dYVc0O1wvx9PeJiCOfWGdkNK/LO9CSlZMa6FPaDrnQF6eRFagly2bZx4HtP2bC8L/t+oJX9TmUZgGFll3CFrmVoCvbJp/7YGfTnqFxsbRrjXC5Nk6BSA+rVb6bDkpyqMW3iMxr/vQ/ERthEK+lSjPaE4A6Ch+9ScfuQbCll5+djF2Opk8lwph61ar/am04q4Jswni4j+yc40wqYWFdWVGYzwdxcBAFEaEhzwvijRPpP4lO/iJy+QhMHBhSbSvsL1tHFbJnEXhvzlv+7u6HoEc3bDQQHE6IKtNjJV7Szcl3TZSBuWHGxNhb4ppun7YSB1+bizo/qgGJDSk2QXMnfq+raSGDqP9BR0EwnPkooHkKgVah9cAxX4X5Lev222/9NCNZa5NEVblsjMsWhnirkfOpZbZ+Szb8V/ujRE2m3MLiGnjJNUqnmFacegb29fmHFKJfm+r/g5wHNvkt2nD52R5AW3GdH7t6Y7/MqTmR5RCKm8ruBHtSE+8HnieASR1GJvMpY6yFrh154+MLdNnRrH3r13B3e1khvFsEHQdfUgfDibBGd1GKyouFj9NDEjIsF4V7hTCmNvBnxXu5Qpf/GdXeSVWE3NvjiCAQDZOYiOA0sc4yckvXKnv67RRaJh0YuqWAFH+ahk9fn4DatapnT5BhP2+SWBIKvvIB9JCvqk58hgKTFf+J6gEGTenM0aDTN57SHhMRs70lA4p'}} response_metadata={'is_blocked': False, 'safety_ratings': [], 'citation_metadata': {'citations': [{'start_index': 2618, 'end_index': 2940, 'uri': 'https://github.com/pytest-dev/pytest', 'license_': 'MIT', 'title': ''}, {'start_index': 2941, 'end_index': 3430, 'uri': 'https://github.com/pytest-dev/pytest', 'license_': 'MIT', 'title': ''}]}, 'usage_metadata': {'prompt_token_count': 741, 'candidates_token_count': 433, 'total_token_count': 1712, 'prompt_tokens_details': [{'modality': 1, 'token_count': 741}], 'candidates_tokens_details': [{'modality': 1, 'token_count': 433}], 'thoughts_token_count': 538, 'cached_content_token_count': 0, 'cache_tokens_details': []}, 'finish_reason': 'STOP', 'avg_logprobs': -0.18122578327980657, 'model_name': 'gemini-2.5-pro'} id='run--94b211bd-3505-4c42-beb8-68632243d608-0' tool_calls=[{'name': 'create_file', 'args': {'content': '# -*- coding: utf-8 -*-\nfrom __future__ import absolute_import\nfrom __future__ import division\nfrom __future__ import print_function\n\nimport sys\n\nimport pytest\n\n\nclass TestPaste(object):\n    @pytest.fixture\n    def pastebin(self, request):\n        return request.config.pluginmanager.getplugin("pastebin")\n\n    @pytest.fixture\n    def mocked_urlopen(self, monkeypatch):\n        """\n        monkeypatch the actual urlopen calls done by the internal plugin\n        function that connects to bpaste service.\n        """\n        calls = []\n\n        def mocked(url, data):\n            calls.append((url, data))\n\n            class DummyFile(object):\n                def read(self):\n                    # part of html of a normal response\n                    return b\'View <a href="/raw/3c0c6750bd">raw</a>.\'\n\n            return DummyFile()\n\n        if sys.version_info < (3, 0):\n            import urllib\n\n            monkeypatch.setattr(urllib, "urlopen", mocked)\n        else:\n            import urllib.request\n\n            monkeypatch.setattr(urllib.request, "urlopen", mocked)\n        return calls\n\n    def test_create_new_paste_uses_text_lexer(self, pastebin, mocked_urlopen):\n        """\n        Test that create_new_paste uses \'text\' as lexer.\n        The output of a pytest run is not python code, so using a python lexer\n        can fail for some outputs. See #5764.\n        """\n        pastebin.create_new_paste(b"full-paste-contents")\n        assert len(mocked_urlopen) == 1\n        _url, data = mocked_urlopen[0]\n        assert "lexer=text" in data.decode("utf-8")\n', 'relative_path': 'testing/test_paste.py'}, 'id': '34f01570-0880-4094-b08c-aed9f879ed2c', 'type': 'tool_call'}] usage_metadata={'input_tokens': 741, 'output_tokens': 433, 'total_tokens': 1712, 'input_token_details': {'cache_read': 0}, 'output_token_details': {'reasoning': 538}}
2025-12-20 22:17:02,683 - thread-130546535499456.app.lang_graph.nodes.bug_reproducing_file_node - DEBUG - content='testing/test_paste.py\n' additional_kwargs={} response_metadata={'is_blocked': False, 'safety_ratings': [], 'usage_metadata': {'prompt_token_count': 1191, 'candidates_token_count': 8, 'total_token_count': 1199, 'prompt_tokens_details': [{'modality': 1, 'token_count': 1729}], 'candidates_tokens_details': [{'modality': 1, 'token_count': 8}], 'thoughts_token_count': 0, 'cached_content_token_count': 0, 'cache_tokens_details': []}, 'finish_reason': 'STOP', 'avg_logprobs': -0.011505108326673508, 'model_name': 'gemini-2.5-pro'} id='run--e27cddb5-4578-4b03-a97c-5423fb89ee14-0' usage_metadata={'input_tokens': 1191, 'output_tokens': 8, 'total_tokens': 1199, 'input_token_details': {'cache_read': 0}}
2025-12-20 22:17:02,733 - thread-130546535499456.app.lang_graph.nodes.git_diff_node - INFO - Generated patch:
diff --git a/testing/test_paste.py b/testing/test_paste.py
new file mode 100644
index 000000000..3f185412c
--- /dev/null
+++ b/testing/test_paste.py
@@ -0,0 +1,53 @@
+# -*- coding: utf-8 -*-
+from __future__ import absolute_import
+from __future__ import division
+from __future__ import print_function
+
+import sys
+
+import pytest
+
+
+class TestPaste(object):
+    @pytest.fixture
+    def pastebin(self, request):
+        return request.config.pluginmanager.getplugin("pastebin")
+
+    @pytest.fixture
+    def mocked_urlopen(self, monkeypatch):
+        """
+        monkeypatch the actual urlopen calls done by the internal plugin
+        function that connects to bpaste service.
+        """
+        calls = []
+
+        def mocked(url, data):
+            calls.append((url, data))
+
+            class DummyFile(object):
+                def read(self):
+                    # part of html of a normal response
+                    return b'View <a href="/raw/3c0c6750bd">raw</a>.'
+
+            return DummyFile()
+
+        if sys.version_info < (3, 0):
+            import urllib
+
+            monkeypatch.setattr(urllib, "urlopen", mocked)
+        else:
+            import urllib.request
+
+            monkeypatch.setattr(urllib.request, "urlopen", mocked)
+        return calls
+
+    def test_create_new_paste_uses_text_lexer(self, pastebin, mocked_urlopen):
+        """
+        Test that create_new_paste uses 'text' as lexer.
+        The output of a pytest run is not python code, so using a python lexer
+        can fail for some outputs. See #5764.
+        """
+        pastebin.create_new_paste(b"full-paste-contents")
+        assert len(mocked_urlopen) == 1
+        _url, data = mocked_urlopen[0]
+        assert "lexer=text" in data.decode("utf-8")

2025-12-20 22:17:02,735 - thread-130546535499456.app.lang_graph.nodes.update_container_node - INFO - Copy over all updated files to the container
2025-12-20 22:17:02,755 - thread-130546535499456.app.docker.base_container - INFO - Resetting git repository in the container
2025-12-20 22:17:02,755 - thread-130546535499456.app.docker.base_container - DEBUG - Executing command: git reset --hard
2025-12-20 22:17:02,856 - thread-130546535499456.app.docker.base_container - DEBUG - Command exit code: 0
2025-12-20 22:17:02,856 - thread-130546535499456.app.docker.base_container - DEBUG - Command output:

HEAD is now at 8aba863a6 Merge pull request #5801 from asottile/flake8_2020

2025-12-20 22:17:02,856 - thread-130546535499456.app.docker.base_container - DEBUG - Executing command: git clean -fd
2025-12-20 22:17:02,958 - thread-130546535499456.app.docker.base_container - DEBUG - Command exit code: 0
2025-12-20 22:17:02,958 - thread-130546535499456.app.docker.base_container - DEBUG - Command output:


2025-12-20 22:17:02,958 - thread-130546535499456.app.docker.base_container - INFO - Updating files in the container after edits.
2025-12-20 22:17:02,958 - thread-130546535499456.app.docker.base_container - INFO - Creating directory testing in the container
2025-12-20 22:17:02,958 - thread-130546535499456.app.docker.base_container - DEBUG - Executing command: mkdir -p testing
2025-12-20 22:17:03,060 - thread-130546535499456.app.docker.base_container - DEBUG - Command exit code: 0
2025-12-20 22:17:03,060 - thread-130546535499456.app.docker.base_container - DEBUG - Command output:


2025-12-20 22:17:03,060 - thread-130546535499456.app.docker.base_container - INFO - Updating testing/test_paste.py in the container
2025-12-20 22:17:03,068 - thread-130546535499456.app.docker.base_container - INFO - Files updated successfully
2025-12-20 22:17:05,572 - thread-130546535499456.app.lang_graph.nodes.bug_reproducing_execute_node - DEBUG - content='' additional_kwargs={'function_call': {'name': 'run_command', 'arguments': '{"command": "pip install -e ."}'}, '__gemini_function_call_thought_signatures__': {'acb3df3a-e6d7-4893-87d5-3aafc2a5f7c5': 'CvAFAY89a1+S+6R+Wut/hdIV8KJa+dRZ38FxIDg3ep6r09CB/3ww/KJuWL5Nrv54Kz/eC3wNvR+axiayyPWtWGrKBt2ON286OiunQBRnCmgzTzsekVyf8WABFEhPO/DJaV4JImRMJgttNrH7MMXZ2wJF9BhwSuvBAubveK/brTYT8TY4xKPn7WX7PxeIPpYrAwd2Q0Cn+3KD43yXSkO3oFEEA56Lub+NsZBbEcRJlbDD26ln4AIyRugT/YhSrVfyi3Pjn47PwyYbTovnxngFjGiPZIR/cxxXG+wapT5wZlhCS7DL1+0IHbs77S30lWxpEhW5F8OpntUvvL8+pxUtMzeAZPcvyZbuq1AWzeYa2On7/uY/NyJhDiCgddppJ0Qt10vapXHlzC9Kdt7ePkKFbK8pEXOWdrrpGlMNmC19rPRzEYKx//Gr5pV7l3k2o683QUEA7Dync32RtJyYms19MkG/r5+WQ2Jwwbu2Q/EcYlb1R1zY8uptZbuw4nvZvMEBRlKCkkcVvOfJHJD5WYtuYqWVYy/OfOeIcr9jkGGlFM4SqqoPPCnQFqDmivkljU9WqLRUG9ENTcbYdWTwF2fifyVdRwrf1cqjtxH2pRMhoFokoL2KfHYO0e+o13xgDDsyMbr5p+LET1g3CL2JTK5rD+00w9VxFjosDq2dmKRVfg0M+EWLjLM7mdywC7Pac5pWRsxOGG+jWyaq+bxunysK5JeAIrTTq/9ARvRsF+QifJdyxICM0xjdDtTqKv3qXv33E5l85QUETL/sn3l/ugbWlGhz2hIxygjduvw0xSLEvL/jNHxmCU11ZsvORlojDov8icAvpN0zRJoeacJWQEyIpuXFKpF1TCLVGn1ieFqB/40NdDj4s+wE3a3SvNLZ1aA+ECz0K9zMyi/5sPmBs+7IA1uflK0CwinEI3qqd+LKqtbAscU7s24dtHcHztiXnYWmU+mNSwoK/sMy0KWrJJ0Vb/wt5qaNkGPxv2Kx41jDnt0WkGI='}} response_metadata={'is_blocked': False, 'safety_ratings': [], 'usage_metadata': {'prompt_token_count': 536, 'candidates_token_count': 9, 'total_token_count': 718, 'prompt_tokens_details': [{'modality': 1, 'token_count': 536}], 'candidates_tokens_details': [{'modality': 1, 'token_count': 9}], 'thoughts_token_count': 173, 'cached_content_token_count': 0, 'cache_tokens_details': []}, 'finish_reason': 'STOP', 'avg_logprobs': -2.682742224799262, 'model_name': 'gemini-2.5-pro'} id='run--819ca400-f6c2-4066-aa4c-7cca4f1f8b3d-0' tool_calls=[{'name': 'run_command', 'args': {'command': 'pip install -e .'}, 'id': 'acb3df3a-e6d7-4893-87d5-3aafc2a5f7c5', 'type': 'tool_call'}] usage_metadata={'input_tokens': 536, 'output_tokens': 9, 'total_tokens': 718, 'input_token_details': {'cache_read': 0}, 'output_token_details': {'reasoning': 173}}
2025-12-20 22:17:05,574 - thread-130546535499456.app.docker.base_container - DEBUG - Executing command: pip install -e .
2025-12-20 22:17:11,352 - thread-130546535499456.app.docker.base_container - DEBUG - Command exit code: 0
2025-12-20 22:17:11,352 - thread-130546535499456.app.docker.base_container - DEBUG - Command output:

Obtaining file:///testbed
  Installing build dependencies ... [?25l- \ | / - done
[?25h  Checking if build backend supports build_editable ... [?25ldone
[?25h  Getting requirements to build editable ... [?25l- done
[?25h  Preparing editable metadata (pyproject.toml) ... [?25l- \ done
[?25hRequirement already satisfied: py>=1.5.0 in /opt/miniconda3/envs/testbed/lib/python3.9/site-packages (from pytest==4.6.6.dev9+g8aba863a6) (1.11.0)
Requirement already satisfied: six>=1.10.0 in /opt/miniconda3/envs/testbed/lib/python3.9/site-packages (from pytest==4.6.6.dev9+g8aba863a6) (1.16.0)
Requirement already satisfied: packaging in /opt/miniconda3/envs/testbed/lib/python3.9/site-packages (from pytest==4.6.6.dev9+g8aba863a6) (23.1)
Requirement already satisfied: attrs>=17.4.0 in /opt/miniconda3/envs/testbed/lib/python3.9/site-packages (from pytest==4.6.6.dev9+g8aba863a6) (23.1.0)
Requirement already satisfied: more-itertools>=4.0.0 in /opt/miniconda3/envs/testbed/lib/python3.9/site-packages (from pytest==4.6.6.dev9+g8aba863a6) (10.1.0)
Requirement already satisfied: atomicwrites>=1.0 in /opt/miniconda3/envs/testbed/lib/python3.9/site-packages (from pytest==4.6.6.dev9+g8aba863a6) (1.4.1)
Requirement already satisfied: pluggy<1.0,>=0.12 in /opt/miniconda3/envs/testbed/lib/python3.9/site-packages (from pytest==4.6.6.dev9+g8aba863a6) (0.13.1)
Requirement already satisfied: importlib-metadata>=0.12 in /opt/miniconda3/envs/testbed/lib/python3.9/site-packages (from pytest==4.6.6.dev9+g8aba863a6) (8.5.0)
Requirement already satisfied: wcwidth in /opt/miniconda3/envs/testbed/lib/python3.9/site-packages (from pytest==4.6.6.dev9+g8aba863a6) (0.2.6)
Requirement already satisfied: zipp>=3.20 in /opt/miniconda3/envs/testbed/lib/python3.9/site-packages (from importlib-metadata>=0.12->pytest==4.6.6.dev9+g8aba863a6) (3.20.2)
Building wheels for collected packages: pytest
  Building editable for pytest (pyproject.toml) ... [?25l- \ done
[?25h  Created wheel for pytest: filename=pytest-4.6.6.dev9+g8aba863a6-0.editable-py2.py3-none-any.whl size=4873 sha256=f3a197ab90d2648daa94ddac769bf9eb73cd850c958a11e01164ce9d96614641
  Stored in directory: /tmp/pip-ephem-wheel-cache-kbnunh13/wheels/7d/66/67/70d1ee2124ccf21d601c352e25cdca10f611f7c8b3f9ffb9e4
Successfully built pytest
Installing collected packages: pytest
  Attempting uninstall: pytest
    Found existing installation: pytest 4.6.6.dev9+g8aba863a6
    Uninstalling pytest-4.6.6.dev9+g8aba863a6:
      Successfully uninstalled pytest-4.6.6.dev9+g8aba863a6
Successfully installed pytest-4.6.6.dev9+g8aba863a6
[33mWARNING: Running pip as the 'root' user can result in broken permissions and conflicting behaviour with the system package manager, possibly rendering your system unusable.It is recommended to use a virtual environment instead: https://pip.pypa.io/warnings/venv. Use the --root-user-action option if you know what you are doing and want to suppress this warning.[0m[33m

2025-12-20 22:17:12,333 - thread-130546535499456.app.lang_graph.nodes.bug_reproducing_execute_node - DEBUG - content='' additional_kwargs={'function_call': {'name': 'run_command', 'arguments': '{"command": "pytest testing/test_paste.py"}'}, '__gemini_function_call_thought_signatures__': {'112e8070-b7f0-402f-8eb5-96aab527c03c': 'CnsBjz1rX7k/YItz1eBGfRfWdLVpg9IQFbkfHQw8l49ZDTJT7tpxoBCuwl3cWM4MxKteYzD1UFf65/NtDwUB7Tx2tomL3o3MzIYhVCFLCG9Asgb5ftfRyUCAUK+zQ7gYptFDyXf0LsAJR21HlWV2NAuNATcS7el+fjwPA8Q='}} response_metadata={'is_blocked': False, 'safety_ratings': [], 'usage_metadata': {'prompt_token_count': 1763, 'candidates_token_count': 12, 'total_token_count': 1797, 'prompt_tokens_details': [{'modality': 1, 'token_count': 1936}], 'candidates_tokens_details': [{'modality': 1, 'token_count': 12}], 'thoughts_token_count': 22, 'cached_content_token_count': 0, 'cache_tokens_details': []}, 'finish_reason': 'STOP', 'avg_logprobs': -0.0782111684481303, 'model_name': 'gemini-2.5-pro'} id='run--d4fdb413-c7f9-40cc-9ad5-02e20ac329d6-0' tool_calls=[{'name': 'run_command', 'args': {'command': 'pytest testing/test_paste.py'}, 'id': '112e8070-b7f0-402f-8eb5-96aab527c03c', 'type': 'tool_call'}] usage_metadata={'input_tokens': 1763, 'output_tokens': 12, 'total_tokens': 1797, 'input_token_details': {'cache_read': 0}, 'output_token_details': {'reasoning': 22}}
2025-12-20 22:17:12,336 - thread-130546535499456.app.docker.base_container - DEBUG - Executing command: pytest testing/test_paste.py
2025-12-20 22:17:12,976 - thread-130546535499456.app.docker.base_container - DEBUG - Command exit code: 1
2025-12-20 22:17:12,976 - thread-130546535499456.app.docker.base_container - DEBUG - Command output:

[1m============================= test session starts ==============================[0m
platform linux -- Python 3.9.20, pytest-4.6.6.dev9+g8aba863a6, py-1.11.0, pluggy-0.13.1
rootdir: /testbed, inifile: tox.ini
[1mcollecting ... [0m[1m
collected 1 item                                                               [0m

testing/test_paste.py [31mF[0m[36m                                                  [100%][0m

=================================== FAILURES ===================================
[31m[1m_______________ TestPaste.test_create_new_paste_uses_text_lexer ________________[0m

self = <test_paste.TestPaste object at 0x7f5acf4d7fa0>
pastebin = <module '_pytest.pastebin' from '/testbed/src/_pytest/pastebin.py'>
mocked_urlopen = [('https://bpaste.net', b'code=full-paste-contents&lexer=python3&expiry=1week')]

[1m    def test_create_new_paste_uses_text_lexer(self, pastebin, mocked_urlopen):[0m
[1m        """[0m
[1m        Test that create_new_paste uses 'text' as lexer.[0m
[1m        The output of a pytest run is not python code, so using a python lexer[0m
[1m        can fail for some outputs. See #5764.[0m
[1m        """[0m
[1m        pastebin.create_new_paste(b"full-paste-contents")[0m
[1m        assert len(mocked_urlopen) == 1[0m
[1m        _url, data = mocked_urlopen[0][0m
[1m>       assert "lexer=text" in data.decode("utf-8")[0m
[1m[31mE       AssertionError: assert 'lexer=text' in 'code=full-paste-contents&lexer=python3&expiry=1week'[0m
[1m[31mE        +  where 'code=full-paste-contents&lexer=python3&expiry=1week' = <built-in method decode of bytes object at 0x7f5acf408630>('utf-8')[0m
[1m[31mE        +    where <built-in method decode of bytes object at 0x7f5acf408630> = b'code=full-paste-contents&lexer=python3&expiry=1week'.decode[0m

[1m[31mtesting/test_paste.py[0m:53: AssertionError
=========================== short test summary info ============================
FAILED testing/test_paste.py::TestPaste::test_create_new_paste_uses_text_lexer
[31m[1m=========================== 1 failed in 0.10 seconds ===========================[0m

2025-12-20 22:17:18,186 - thread-130546535499456.app.lang_graph.nodes.bug_reproducing_execute_node - DEBUG - content='I have successfully executed the test file `testing/test_paste.py` and reproduced the bug. Here is the output of the test run:\n\n```\n============================= test session starts ==============================\nplatform linux -- Python 3.9.20, pytest-4.6.6.dev9+g8aba863a6, py-1.11.0, pluggy-0.13.1\nrootdir: /testbed, inifile: tox.ini\ncollecting ... \ncollected 1 item                                                               \n\ntesting/test_paste.py F                                                  [100%]\n\n=================================== FAILURES ===================================\n_______________ TestPaste.test_create_new_paste_uses_text_lexer ________________\n\nself = <test_paste.TestPaste object at 0x7f5acf4d7fa0>\npastebin = <module \'_pytest.pastebin\' from \'/testbed/src/_pytest/pastebin.py\'>\nmocked_urlopen = [(\'https://bpaste.net\', b\'code=full-paste-contents&lexer=python3&expiry=1week\')]\n\n    def test_create_new_paste_uses_text_lexer(self, pastebin, mocked_urlopen):\n        """\n        Test that create_new_paste uses \'text\' as lexer.\n        The output of a pytest run is not python code, so using a python lexer\n        can fail for some outputs. See #5764.\n        """\n        pastebin.create_new_paste(b"full-paste-contents")\n        assert len(mocked_urlopen) == 1\n        _url, data = mocked_urlopen[0]\n>       assert "lexer=text" in data.decode("utf-8")\nE       AssertionError: assert \'lexer=text\' in \'code=full-paste-contents&lexer=python3&expiry=1week\'\nE        +  where \'code=full-paste-contents&lexer=python3&expiry=1week\' = <built-in method decode of bytes object at 0x7f5acf408630>(\'utf-8\')\nE        +    where <built-in method decode of bytes object at 0x7f5acf408630> = b\'code=full-paste-contents&lexer=python3&expiry=1week\'.decode\n\ntesting/test_paste.py:53: AssertionError\n=========================== short test summary info ============================\nFAILED testing/test_paste.py::TestPaste::test_create_new_paste_uses_text_lexer\n=========================== 1 failed in 0.10 seconds ===========================\n```' additional_kwargs={} response_metadata={'is_blocked': False, 'safety_ratings': [], 'usage_metadata': {'prompt_token_count': 2503, 'candidates_token_count': 604, 'total_token_count': 3178, 'cached_content_token_count': 1555, 'prompt_tokens_details': [{'modality': 1, 'token_count': 2698}], 'cache_tokens_details': [{'modality': 1, 'token_count': 1555}], 'candidates_tokens_details': [{'modality': 1, 'token_count': 604}], 'thoughts_token_count': 71}, 'finish_reason': 'STOP', 'avg_logprobs': -0.011075915879761146, 'model_name': 'gemini-2.5-pro'} id='run--834c0b38-d6aa-4cf8-aae3-291d3a0da6f2-0' usage_metadata={'input_tokens': 2503, 'output_tokens': 604, 'total_tokens': 3178, 'input_token_details': {'cache_read': 1555}, 'output_token_details': {'reasoning': 71}}
2025-12-20 22:17:28,314 - thread-130546535499456.app.lang_graph.nodes.bug_reproducing_structured_node - DEBUG - reproduced_bug=True reproduced_bug_failure_log="FAILED testing/test_paste.py::TestPaste::test_create_new_paste_uses_text_lexer - AssertionError: assert 'lexer=text' in 'code=full-paste-contents&lexer=python3&expiry=1week'" reproduced_bug_commands=['pytest testing/test_paste.py']
2025-12-20 22:17:28,316 - thread-130546535499456.app.lang_graph.nodes.dual_version_validation_node - INFO - Starting dual-version validation
2025-12-20 22:17:28,316 - thread-130546535499456.app.lang_graph.nodes.dual_version_validation_node - INFO - Running test on old codebase (should fail)
2025-12-20 22:17:28,316 - thread-130546535499456.app.docker.base_container - DEBUG - Executing command: pytest testing/test_paste.py
2025-12-20 22:17:28,740 - thread-130546535499456.app.docker.base_container - DEBUG - Command exit code: 1
2025-12-20 22:17:28,740 - thread-130546535499456.app.docker.base_container - DEBUG - Command output:

[1m============================= test session starts ==============================[0m
platform linux -- Python 3.9.20, pytest-4.6.6.dev9+g8aba863a6, py-1.11.0, pluggy-0.13.1
rootdir: /testbed, inifile: tox.ini
[1mcollecting ... [0m[1m
collected 1 item                                                               [0m

testing/test_paste.py [31mF[0m[36m                                                  [100%][0m

=================================== FAILURES ===================================
[31m[1m_______________ TestPaste.test_create_new_paste_uses_text_lexer ________________[0m

self = <test_paste.TestPaste object at 0x7c0a1b018490>
pastebin = <module '_pytest.pastebin' from '/testbed/src/_pytest/pastebin.py'>
mocked_urlopen = [('https://bpaste.net', b'code=full-paste-contents&lexer=python3&expiry=1week')]

[1m    def test_create_new_paste_uses_text_lexer(self, pastebin, mocked_urlopen):[0m
[1m        """[0m
[1m        Test that create_new_paste uses 'text' as lexer.[0m
[1m        The output of a pytest run is not python code, so using a python lexer[0m
[1m        can fail for some outputs. See #5764.[0m
[1m        """[0m
[1m        pastebin.create_new_paste(b"full-paste-contents")[0m
[1m        assert len(mocked_urlopen) == 1[0m
[1m        _url, data = mocked_urlopen[0][0m
[1m>       assert "lexer=text" in data.decode("utf-8")[0m
[1m[31mE       AssertionError: assert 'lexer=text' in 'code=full-paste-contents&lexer=python3&expiry=1week'[0m
[1m[31mE        +  where 'code=full-paste-contents&lexer=python3&expiry=1week' = <built-in method decode of bytes object at 0x7c0a1b03f5d0>('utf-8')[0m
[1m[31mE        +    where <built-in method decode of bytes object at 0x7c0a1b03f5d0> = b'code=full-paste-contents&lexer=python3&expiry=1week'.decode[0m

[1m[31mtesting/test_paste.py[0m:53: AssertionError
=========================== short test summary info ============================
FAILED testing/test_paste.py::TestPaste::test_create_new_paste_uses_text_lexer
[31m[1m=========================== 1 failed in 0.09 seconds ===========================[0m

2025-12-20 22:17:28,740 - thread-130546535499456.app.lang_graph.nodes.dual_version_validation_node - INFO - Test failed on old codebase (as expected)
2025-12-20 22:17:28,740 - thread-130546535499456.app.lang_graph.nodes.dual_version_validation_node - INFO - Applying patch to repository
2025-12-20 22:17:28,745 - thread-130546535499456.app.lang_graph.nodes.dual_version_validation_node - INFO - Updating container with patched code
2025-12-20 22:17:28,745 - thread-130546535499456.app.docker.base_container - INFO - Updating files in the container after edits.
2025-12-20 22:17:28,745 - thread-130546535499456.app.docker.base_container - INFO - Creating directory src/_pytest in the container
2025-12-20 22:17:28,745 - thread-130546535499456.app.docker.base_container - DEBUG - Executing command: mkdir -p src/_pytest
2025-12-20 22:17:28,847 - thread-130546535499456.app.docker.base_container - DEBUG - Command exit code: 0
2025-12-20 22:17:28,847 - thread-130546535499456.app.docker.base_container - DEBUG - Command output:


2025-12-20 22:17:28,847 - thread-130546535499456.app.docker.base_container - INFO - Creating directory testing in the container
2025-12-20 22:17:28,847 - thread-130546535499456.app.docker.base_container - DEBUG - Executing command: mkdir -p testing
2025-12-20 22:17:28,948 - thread-130546535499456.app.docker.base_container - DEBUG - Command exit code: 0
2025-12-20 22:17:28,948 - thread-130546535499456.app.docker.base_container - DEBUG - Command output:


2025-12-20 22:17:28,949 - thread-130546535499456.app.docker.base_container - INFO - Updating testing/test_pastebin.py in the container
2025-12-20 22:17:28,949 - thread-130546535499456.app.docker.base_container - INFO - Updating src/_pytest/pastebin.py in the container
2025-12-20 22:17:28,956 - thread-130546535499456.app.docker.base_container - INFO - Files updated successfully
2025-12-20 22:17:28,956 - thread-130546535499456.app.lang_graph.nodes.dual_version_validation_node - INFO - Running test on patched codebase (should pass)
2025-12-20 22:17:28,956 - thread-130546535499456.app.docker.base_container - DEBUG - Executing command: pytest testing/test_paste.py
2025-12-20 22:17:29,346 - thread-130546535499456.app.docker.base_container - DEBUG - Command exit code: 0
2025-12-20 22:17:29,347 - thread-130546535499456.app.docker.base_container - DEBUG - Command output:

[1m============================= test session starts ==============================[0m
platform linux -- Python 3.9.20, pytest-4.6.6.dev9+g8aba863a6, py-1.11.0, pluggy-0.13.1
rootdir: /testbed, inifile: tox.ini
[1mcollecting ... [0m[1m
collected 1 item                                                               [0m

testing/test_paste.py [32m.[0m[36m                                                  [100%][0m

[32m[1m=========================== 1 passed in 0.05 seconds ===========================[0m

2025-12-20 22:17:29,347 - thread-130546535499456.app.lang_graph.nodes.dual_version_validation_node - INFO - Resetting repository to clean state
2025-12-20 22:17:29,360 - thread-130546535499456.app.lang_graph.nodes.dual_version_validation_node - INFO - Validation PASSED: Test fails on old, passes on new
2025-12-20 22:17:29,361 - thread-130546535499456.app.docker.base_container - INFO - Cleaning up container and temporary files
2025-12-20 22:17:29,362 - thread-130546535499456.app.docker.base_container - INFO - Closing persistent shell...
2025-12-20 22:17:29,462 - thread-130546535499456.app.docker.base_container - INFO - Cleaning up container and temporary files
